<?xml version="1.0" encoding="UTF-8" standalone="no" ?>
<!DOCTYPE sourcedocuments  PUBLIC "-//Paul Golder//DTD jcerttemplate//EN" "http://lerot.org/Templates/jcerttemplate.dtd">


  <sourcedocuments>
       <sourcedocument>
         <stylesheet>Templates/GROMarriageCertCopy_stylesheet.xsl</stylesheet>
         <name>GRO Copy of an entry of marriage</name>
         <author>Paul A Golder</author>
         <editdate>13 April 2009</editdate>
          <type>Marriage certificate</type>
          <savefilepattern>gromarriage.xml</savefilepattern>
          <templateID>engmarriage20090415</templateID>
          <country>England</country>
          <certificate  objecttype="certificate" name="main"  backgroundcolor="#CEF6CE" >    
                <styleblock name="inputcell"  bordercolor="gray"  borderwidth="1"  backgroundcolor="#E4DCDC"  />
                <hgroup name="heading"  >  
                  <vblock>
                          <label  font-size="16"  foregroundcolor="#04B404" >UK Certified Copy of an entry of Marriage</label>
                  </vblock> 
                  <vblock >
                  </vblock>
                    <vgroup align="left">
                      <hblock name ="given"> 
                        <label align="right"  name ="reg"   font-size="16"  foregroundcolor="#04B404" >Given at the General Register Office</label>
                      </hblock>
                      <hblock>
                        <label font-style="italic"   foregroundcolor="black" > Application Number</label>
                       <input target="applicationNumber"   width="60" />
                     </hblock>
                   </vgroup>
                </hgroup>         
              <hgroup height="50" />
              <hgroup objecttype="marriage"  borderwidth="0" >
              <vgroup name="registrationlocation">
                <hblock>
                  <input   target="year"  />
                  <label>Marriage Solemnized at </label>
                  <input   target="location1"/>
                  <label>in the</label>
                  <input   target="location2"  />
                  <label>of</label>
                  <input   target="location3"  />
                  <label>in the county of</label>
                  <input   target="location4"  />
                </hblock>
              </vgroup>
              </hgroup>
              <hgroup height="30"/>
              <table   name="marriage" rows="1" objecttype="marriage"  >
                <hgroup>
                <vblock>
                  <label>No.</label>
                </vblock>
                <vblock>
                  <label>When Married</label>
                </vblock>
                <vblock>
                  <label>Name and Surname</label>
                </vblock>
                <vblock>
                  <label>age</label>
                </vblock>
                <vblock>
                  <label>condition</label>
                </vblock>
                <vblock>
                  <label>Rank or Profession</label>
                </vblock>
                <vblock>
                  <label>Residence at time of marriage</label>
                </vblock>
                <vblock>
                  <label>Fathers name and Surname</label>               
                </vblock>
               <vblock>
                  <label>Rank or Profession of</label>
                  <label>Father</label>
                </vblock>
                </hgroup>
                <hgroup   objecttype="marriage" >
                <vblock>
                  <input      target="entryno" /> 
                </vblock>
                <vblock>
                  <input      target="when" /> 
                </vblock>
                <vblock>
                  <input     target="groom.name" /> 
                  <input      target="bride.name" /> 
                </vblock>
                <vblock>
                  <input      target="groom.age" /> 
                  <input      target="bride.age" />
                </vblock>
                <vblock>
                  <input      target="groom.condition" /> 
                  <input      target="bride.condition" /> 
                </vblock>
                <vblock>
                  <input      target="groom.profession" /> 
                     <input      target="bride.profession" /> 
                </vblock>
                <vblock>
                  <input      target="groom.residence" /> 
                    <input      target="bride.residence" /> 
                </vblock>
                <vblock>          
                  <input      target="groom.father" /> 
                      <input      target="bride.father" /> 
                </vblock>
               <vblock>
                  <input      target="groom.fatheroccupation" /> 
                  <input      target="bride.fatheroccupation" /> 
                </vblock>
                </hgroup>
              </table>
              <hgroup height="30" />
               <vgroup  name="marriagerites"  objecttype="marriage" >
                <hblock  >            
                  <label>Married in the  </label>
                  <input   target="location5"/>
                  <label>according to the Rites and ceremonies of the Established Church, by</label>
                  <input   target="licence"  />
                  <label>or after</label>
                  <input   target="banns"  />
                  <label>by me</label>
                </hblock>   
                <hblock>
                    <vblock />
                    <input width="100" align="right"  target="official"  />
                </hblock>
              </vgroup>    
              <hgroup height="20" />
              <hgroup name="bottomgroup" direction="horizontal"  objecttype="marriage" >
                <vblock>
                  <label  font-size="10" >
                    <text>This marriage</text>
                  <text>was solemnized</text>
                  <text>between us</text>
                  </label>
                </vblock>
                <vblock objecttype="marriage" >
                   <input      target="groom.signature" /> 
                  <input      target="bride.signature" /> 
                </vblock>
                  <vblock>
                  <label  font-size="10" >
                    <text>in the</text>
                  <text>presence</text>
                    <text>of us</text>
                  </label>
                </vblock>
                <vblock>
                   <input      target="witness.first" /> 
                  <input      target="witness.second" /> 
                </vblock>
              </hgroup>       
               <hgroup height="60"   borderwidth="0"  padding="10" />
              <vgroup padding="20" >
                <hblock>
                  <label   foregroundcolor="#04B404" >CERTIFIED to be a true copy of an entry in the certified copy of a Register of Marriages in the Registration Districtof.</label>
                  <input      target="registrationDistrict" /> 
                </hblock>
                <hblock>
                  <label   foregroundcolor="#04B404" >Given at the GENERAL REGISTER OFFICE under the seal of the said Office, the </label>
                  <input target="issue.day" />
                  <label>day of</label>
                  <input target="issue.month" />
                  <input target ="issue.year" />
                </hblock>
              </vgroup>         
          
                <vgroup>
                <hblock>
                  <input target="issue.number"  width="50"/>
                  <label/>
                </hblock>
              </vgroup>
          </certificate>                
       </sourcedocument>
  </sourcedocuments>
