<?xml version="1.0" encoding="UTF-8" standalone="no" ?>
<!DOCTYPE sourcedocuments  PUBLIC "-//Paul Golder//DTD jcerttemplate//EN" "http://lerot.org/Templates/jcerttemplate.dtd">


  <sourcedocuments>
       <sourcedocument>
         <stylesheet>/Stylesheets/GROBirthCopy_stylesheet.xsl</stylesheet>
         <name>GRO Copy of an entry of Birth</name>
         <author>Paul A Golder</author>
         <editdate>15 April 2009</editdate>
          <type>Birth certificate</type>
          <country>England</country>
          <templateID>GROBirthCopy-0.2</templateID>
              <certificate  name="top"  objecttype ="certificate"  backgroundcolor="#84E96A"    foregroundcolor="#CB410E" >
                <styleblock name="inputcell"  bordercolor="gray"  borderwidth="1"  backgroundcolor="#E4DCDC"  />
                <hgroup name="heading"  >  
                  <vblock>
                    <label >CERTIFIED COPY OF AN ENTRY OF BIRTH</label>
                  </vblock> 
                  <vblock >
                  </vblock>
                    <vgroup align="left">
                      <hblock name ="given"> 
                        <label align="right"  name ="reg"  >GIVEN AT THE GENERAL REGISTER OFFICE</label>
                      </hblock>
                      <hblock>
                        <label font-style="italic"   foregroundcolor="black" > Application Number</label>
                       <input target="applicationNumber"   width="60" />
                     </hblock>
                   </vgroup>
                </hgroup>
                <hgroup height="10"    >
                </hgroup>
              <vgroup name="certificate"  borderwidth="1"  foregroundcolor="#CB410E"   padding="20">
                <hblock borderwidth="0"  >
                  <label   >REGISTRATION DISTRICT</label>
                  <input    target="district"  />
                </hblock>
                <hblock  borderwidth="0" >
                  <input target ="year"  />
                  <label > BIRTH in the Sub-district of</label>
                  <input    target="subdistrict" />
                  <label >in the</label>
                  <input     target="county" />
                </hblock>
              </vgroup>         
              <table name="births"    borderwidth="1"   foregroundcolor="black"    >
                <hgroup borderwidth="0"  >
                <vblock align="center" >
                  <label  verticalalign="top" >
                    <text>Columns:-</text>
                    <text>No.</text>
                  </label>
                </vblock>
                <vblock>
                  <label>
                    <text>1</text>
                    <text>When and.</text>
                    <text>where born</text>
                  </label>
                </vblock>
                <vblock>
                  <label>
                    <text>2</text>
                    <text>Name if any.</text>
                  </label>
                </vblock>
                <vblock>
                  <label>
                    <text>3</text>
                    <text>Sex</text>
                  </label>
                </vblock>
                <vblock>
                  <label>
                    <text>4</text>
                    <text>Name and Surname</text>
                     <text>of Father</text>
                  </label>
                </vblock>
                <vblock>
                  <label>
                    <text>5</text>
                    <text>Name surname and</text>
                    <text>maiden surname</text>
                    <text>of mother</text>
                  </label>
                </vblock>
                <vblock>
                  <label>
                    <text>6</text>
                    <text>Occupation</text>
                    <text>of Father</text>
                  </label>
                </vblock>
                <vblock>
                  <label>
                    <text>7</text>
                    <text>Signature, description and</text>
                    <text>residence of informant</text>
                  </label>
                </vblock>
               <vblock>
                  <label>
                    <text>8</text>
                  <text>When</text>
                  <text>registered</text>
                  </label>
                </vblock>
                <vblock>
                  <label>
                    <text>9</text>
                    <text>Signature of registrar</text>
                  </label>
                </vblock>   
                <vblock>
                  <label>
                    <text>10</text>
                    <text>Name entered</text>
                    <text>after registration</text>
                  </label>
                </vblock>  
                </hgroup>
                 <hgroup   objecttype ="birth"  borderwidth="0"  >
                <vblock align="center" >
                  <input   target="entryNo" /> 
                </vblock>>
                <vblock>>
                  <input       target="whenAndWhere" /> 
                </vblock>
                <vblock>
                  <input     target="name" /> 
                </vblock>
                <vblock>
                  <input     target="gender" /> 
                </vblock>
                <vblock>
                  <input     target="fathersName" /> 
                </vblock>
                <vblock>
                  <input     target="mothersName" /> 
                </vblock>
                <vblock>
                  <input     target="fathersOccupation" /> 
                </vblock>
                <vblock>
                  <input     target="informant" /> 
                </vblock>
               <vblock>
                  <input     target="registrationDate" /> 
                </vblock>
                <vblock>
                  <input     target="registrar" /> 
                </vblock>   
                <vblock>
                  <input     target="nameEnteredLate" /> 
                </vblock>  
                </hgroup>
              </table>
              <hgroup height="20"  />
              <vgroup  padding="10"   >
                <hblock>
                  <label align="left" >CERTIFIED to be a true copy of an entry in the certified copy of a Register of Births on the District above mentioned.</label>
                  <label  />
                </hblock>
                <hblock>
                  <label  >Given at the GENERAL REGISTER OFFICE under the seal of the said Office, the </label>
                  <input target="issueDay" />
                  <label >day of</label>
                  <input target="issueMonth" />
                  <input target ="issueYear" />
                </hblock>       
                <hblock name="hline" backgroundcolor="red"  height="5"  />
                <hblock>
                  <input target="issueNumber" />
                  <label></label>
                </hblock>
              </vgroup>
              </certificate>
       </sourcedocument>
  </sourcedocuments>